{
  "artifactSha256": "sha256:223775280426692483e4dfc09152b60dc3747620f70c1eb8af12ca3e84b8b511",
  "generator": {
    "name": "wellm",
    "version": "0.2.0rc4"
  },
  "schema": "wellm.artifact-metadata/v1",
  "schemaRef": "fixtures/manifest.schema.json",
  "schemaSha256": "sha256:33cb8154e363b2a147a1499eef116f329d8d513d3a3c8cc9c5ba5f67d5230c41",
  "semanticSha256": "sha256:d1dde86327a1a70bfcfe1d9cccca740cbbae55f96d9a47ae566856507f1da753",
  "source": "manifest.wm",
  "sourceDialect": "typed@1",
  "sourceSha256": "sha256:dd70f49d8a3c4d7a496be11203e35c09c8eafb160813f7f1940e18bf765b1a36",
  "target": "generated/manifest.default.json",
  "targetProfile": "repo-json@1"
}
